{"baseSha":"9a04e3f26fba71452a65e69bd380577cb3dc47ee","candidateOutputBundleDigest":"4ff46ced7a1c38cbaab198c0cb873809ef9cfbba24d912dc133b2b307224d3fd","claimId":"c75385229f711a8048a58d15a15618db09996c15938bca0f47db31ea77f0a814","deliveryHead":"4a462b38d4cd811b34e9ec93f8c4ee4b3899e9ba","executionBundleDigest":"06095243b2199672243b559e0af2798fb9e051e33281775b98bc68c8b16ac48a","generatedAt":"2026-08-29T06:08:53Z","generator":"gkd-verify","implementationHead":"4a462b38d4cd811b34e9ec93f8c4ee4b3899e9ba","kind":"candidate-result-manifest","manifestDigest":"88f24408175aaf371957edebac0e04dfe47273f20fa8a68aa1658d2adf296a03","repository":"github.com/KNaiFen/gkd","schemaVersion":1,"scopeDigest":"0979a30d05d1342613d452f58fe01ad9cbb31c1d4b7101b698c53059744eb020","scopes":[{"name":"foundation","resultDigest":"eaee608040689217b64bb2f7ec869fb871de6eaa0b666a81580b1fa18a149e8a"},{"name":"m3-ci-policy","resultDigest":"73a9da9b3e081ca134eb9a34f1624360594d00cef346292fa860a48754168a1f"},{"name":"m3-resource-scanner","resultDigest":"aa1636b1507df2fc101a10e1079990dc8353ea0675bf5319fc3b2336701435fa"},{"name":"m3-review-core","resultDigest":"46df41fd48f1519ed6907a67570d01bf2fb1a3a50be287571b8a3dd77c8970e9"},{"name":"m4-finalization","resultDigest":"069b522b053a7c38b1892fadd75b93f2a3889cd5c28afca82b2cbf9ba3f7e389"},{"name":"m5-release-candidate","resultDigest":"7e4ef2d1c90dfa864e40a992b490d65cd993900241535a543cd5940b826f2ba6"},{"name":"p1-production-migration","resultDigest":"767bd99dd9347bfea52d00b11a3b84e1a8282fbc6230c345caee23fc6eb6ef23"},{"name":"role-routing","resultDigest":"06dc89dba1aac2189fbc3cfdcb6e8032dc94a8df52f36b87450eff838c64dfe3"},{"name":"runtime-bridge","resultDigest":"4f95ce68e8147c5e9b420f0e45eb16d10758dee98bbb9ee27c9c91de45e29ef9"},{"name":"task-core","resultDigest":"928a8c8947a2ee6fe63b24b920e14b82686d1d66b2f87a9cb9e076a6284d537c"},{"name":"watcher-core-and-live-negative","resultDigest":"ac8add8bc546e191f9b859afb4b8f6612680f2669c24d740cc3ae489d40e4c29"}],"taskBranch":"task/gkd-gate-repair-r1","taskId":"GKD-GATE-REPAIR-R1"}
