{"baseSha":"69cd40d0fa31b45ba3ce36e24eda2c42125fcd15","candidateOutputBundleDigest":"f39700161c8b416f97a8ac7cb2c20ada70d4d12dcb3b2575b4134268c74a8e5d","claimId":"17ee31c22f39949ba12457935e65979e3b9ad2229dbacae62aa9424283dae637","deliveryHead":"48463279a469e28e77bae7e0614f2410571ab69b","executionBundleDigest":"06095243b2199672243b559e0af2798fb9e051e33281775b98bc68c8b16ac48a","generatedAt":"2026-08-29T00:30:00Z","generator":"gkd-gate-repair-contracts","implementationHead":"48463279a469e28e77bae7e0614f2410571ab69b","kind":"candidate-result-manifest","manifestDigest":"a788ca6e4e99835ff4813ad5074f17e221a5659baf39e19bbf5dd9e78131e636","repository":"github.com/KNaiFen/gkd","schemaVersion":1,"scopeDigest":"dba3372fef5bccc143f74c1c358214527013ae9577dd107b977a46c8d0c42f57","scopes":[{"name":"gate-repair","resultDigest":"d81e86c6bf0ed7035d4a780f3e833a68e88b064df27c8d555dd54803b058904e"},{"name":"task-core","resultDigest":"7d4f6bfde5ad7bd9b7f2e9de3e4f0c596fc11a06da8c59e3e8dd95405ad1c58d"}],"taskBranch":"task/gkd-gate-repair","taskId":"GKD-GATE-REPAIR"}
